{
  "sourceLocator": "archive.zip!/TAXREF_LIENS.txt#record=1",
  "recordNumber": 1,
  "sourceAcronym": "WFO (World Flora Online)",
  "sourceType": "CSD",
  "sourceAuthors": "",
  "sourceTitle": "World Flora Online",
  "sourceUrl": "https://www.worldfloraonline.org",
  "taxrefIdentifier": "100",
  "externalIdentifier": "wfo-0000000001",
  "externalUrl": "https://www.worldfloraonline.org/taxon/wfo-0000000001"
}
